{
  "expected_counts": {
    "by_report": {
      "addendum": 1,
      "additional": 41,
      "original": 67,
      "stack": 26
    },
    "total": 135
  },
  "normalization": "UTF-8; CRLF and CR converted to LF; exactly one terminal LF",
  "report_order": [
    "stack",
    "addendum",
    "additional",
    "original"
  ],
  "reports": [
    {
      "byte_count": 13758,
      "expected_rows": 26,
      "line_count": 98,
      "normalized_sha256": "9458454bb20355c2ff4d6239545378e1db99290b05197ca258e1d42d68ec8d5e",
      "origin_sha256": "ec0b8361cad4bca54b60df61cb9b5b93c4de2ff0737b9b1121d6fa1debd09abc",
      "path": "sources/stack-report.md",
      "report_id": "stack",
      "vulnerable_commit": "e9cf7c602b664da195700d8cca0ca5565e4dec4d"
    },
    {
      "byte_count": 305,
      "expected_rows": 1,
      "line_count": 1,
      "normalized_sha256": "d6c65892df67f0149792ad23f379adfdf8d3f26872436fab90a72b7cf3c876a9",
      "origin_sha256": "d6c65892df67f0149792ad23f379adfdf8d3f26872436fab90a72b7cf3c876a9",
      "path": "sources/npm-harness-addendum.md",
      "report_id": "addendum",
      "vulnerable_commit": "e9cf7c602b664da195700d8cca0ca5565e4dec4d"
    },
    {
      "byte_count": 9319,
      "expected_rows": 41,
      "line_count": 101,
      "normalized_sha256": "03421275563636a3fa538c594362afefd9377e11ee316ee211894b8526a8bfd2",
      "origin_sha256": "2c513128cce572167cce567164a9c2c36d6e0e70438abe0e1ed94a93ccde60fb",
      "path": "sources/additional-report.md",
      "report_id": "additional",
      "vulnerable_commit": "d7ce6b3689da539e6e7e11cc4f2ac66bc6bba7ad"
    },
    {
      "byte_count": 16695,
      "expected_rows": 67,
      "line_count": 120,
      "normalized_sha256": "2dcc8c7062243c39fb713915b0a3c081b3ead595b0eb7de00c6d2b4c172f7b95",
      "origin_sha256": "f2da4794ed84586911512ddeba9708b52864dfd972bd326c79a69688a4729b5e",
      "path": "sources/original-report.md",
      "report_id": "original",
      "vulnerable_commit": "d7ce6b3689da539e6e7e11cc4f2ac66bc6bba7ad"
    }
  ],
  "schema_version": 1,
  "sources": [
    {
      "block_sha256": "3411e7d672cabae86014b128045bea909f442a01cae059d455f198177c45b1dd",
      "evidence": [
        {
          "commit": "e9cf7c602b664da195700d8cca0ca5565e4dec4d",
          "line_end": 3211,
          "line_start": 3153,
          "path": "crates/tirith/src/cli/gateway.rs"
        }
      ],
      "ledger_ordinal": 1,
      "normalized_severity": "critical",
      "report_id": "stack",
      "report_ordinal": 1,
      "reported_severity": "Critical",
      "section": "critical_and_inherited_blockers",
      "source_id": "STACK-001",
      "source_locator": {
        "line_end": 23,
        "line_start": 23,
        "path": "sources/stack-report.md"
      },
      "title": "MCP clients can bypass enforcement with `TIRITH=0`",
      "vulnerable_commit": "e9cf7c602b664da195700d8cca0ca5565e4dec4d"
    },
    {
      "block_sha256": "a075dc63a9cae6ab271f9dd4db4f970c65b9c7ce9778fd0c6041088ab70f2baa",
      "evidence": [
        {
          "commit": "e9cf7c602b664da195700d8cca0ca5565e4dec4d",
          "line_end": 3724,
          "line_start": 3698,
          "path": "crates/tirith/src/cli/gateway.rs"
        }
      ],
      "ledger_ordinal": 2,
      "normalized_severity": "high",
      "report_id": "stack",
      "report_ordinal": 2,
      "reported_severity": "High",
      "section": "critical_and_inherited_blockers",
      "source_id": "STACK-002",
      "source_locator": {
        "line_end": 25,
        "line_start": 25,
        "path": "sources/stack-report.md"
      },
      "title": "one command field is inspected while the entire request is forwarded",
      "vulnerable_commit": "e9cf7c602b664da195700d8cca0ca5565e4dec4d"
    },
    {
      "block_sha256": "bf82bf55b82fdd797b6abc362b32cdf284d94b74e395ab97254982565af3e442",
      "evidence": [
        {
          "commit": "e9cf7c602b664da195700d8cca0ca5565e4dec4d",
          "line_end": 597,
          "line_start": 569,
          "path": "crates/tirith-core/src/content_kind.rs"
        }
      ],
      "ledger_ordinal": 3,
      "normalized_severity": "high",
      "report_id": "stack",
      "report_ordinal": 3,
      "reported_severity": "High",
      "section": "pr_197_c00_c03",
      "source_id": "STACK-003",
      "source_locator": {
        "line_end": 29,
        "line_start": 29,
        "path": "sources/stack-report.md"
      },
      "title": "PDF+ZIP polyglot bypass",
      "vulnerable_commit": "e9cf7c602b664da195700d8cca0ca5565e4dec4d"
    },
    {
      "block_sha256": "176494a4485d985ca8df04f1fb68567e723e4c02b0ac8987b7f29df1432ebf84",
      "evidence": [
        {
          "commit": "e9cf7c602b664da195700d8cca0ca5565e4dec4d",
          "line_end": 6387,
          "line_start": 6332,
          "path": "crates/tirith-core/src/rules/rendered.rs"
        }
      ],
      "ledger_ordinal": 4,
      "normalized_severity": "medium",
      "report_id": "stack",
      "report_ordinal": 4,
      "reported_severity": "Medium",
      "section": "pr_197_c00_c03",
      "source_id": "STACK-004",
      "source_locator": {
        "line_end": 31,
        "line_start": 31,
        "path": "sources/stack-report.md"
      },
      "title": "failed PDF analysis reports complete coverage",
      "vulnerable_commit": "e9cf7c602b664da195700d8cca0ca5565e4dec4d"
    },
    {
      "block_sha256": "aa71e82913db9bd464793a464f2095819afc2ae33ef3424c4949aa6bda8fc53b",
      "evidence": [
        {
          "commit": "e9cf7c602b664da195700d8cca0ca5565e4dec4d",
          "line_end": 31,
          "line_start": 10,
          "path": "crates/tirith-core/src/mcp/resources.rs"
        },
        {
          "commit": "e9cf7c602b664da195700d8cca0ca5565e4dec4d",
          "line_end": 462,
          "line_start": 451,
          "path": "crates/tirith/src/cli/scan.rs"
        }
      ],
      "ledger_ordinal": 5,
      "normalized_severity": "medium",
      "report_id": "stack",
      "report_ordinal": 5,
      "reported_severity": "Medium",
      "section": "pr_197_c00_c03",
      "source_id": "STACK-005",
      "source_locator": {
        "line_end": 33,
        "line_start": 33,
        "path": "sources/stack-report.md"
      },
      "title": "CLI/MCP completeness contradicts findings",
      "vulnerable_commit": "e9cf7c602b664da195700d8cca0ca5565e4dec4d"
    },
    {
      "block_sha256": "7447a7f3e4c894bc82c4370b347a975e506731da3b1082fec11f4bf58a5fd499",
      "evidence": [
        {
          "commit": "e9cf7c602b664da195700d8cca0ca5565e4dec4d",
          "line_end": 43,
          "line_start": 36,
          "path": "crates/tirith-core/src/rules/web3_gate.rs"
        },
        {
          "commit": "e9cf7c602b664da195700d8cca0ca5565e4dec4d",
          "line_end": 233,
          "line_start": 195,
          "path": "crates/tirith-core/src/web3_policy.rs"
        }
      ],
      "ledger_ordinal": 6,
      "normalized_severity": "high",
      "report_id": "stack",
      "report_ordinal": 6,
      "reported_severity": "High",
      "section": "pr_198_c04_c12",
      "source_id": "STACK-006",
      "source_locator": {
        "line_end": 37,
        "line_start": 37,
        "path": "sources/stack-report.md"
      },
      "title": "most `web3_guard` controls are configuration-only",
      "vulnerable_commit": "e9cf7c602b664da195700d8cca0ca5565e4dec4d"
    },
    {
      "block_sha256": "c6fcb4dcf3110477c7dc6103e4825042caf4ca46dfe1e89efe1de9b6ee7d391b",
      "evidence": [
        {
          "commit": "e9cf7c602b664da195700d8cca0ca5565e4dec4d",
          "line_end": 401,
          "line_start": 287,
          "path": "crates/tirith-core/src/rules/web3_gate.rs"
        }
      ],
      "ledger_ordinal": 7,
      "normalized_severity": "high",
      "report_id": "stack",
      "report_ordinal": 7,
      "reported_severity": "High",
      "section": "pr_198_c04_c12",
      "source_id": "STACK-007",
      "source_locator": {
        "line_end": 39,
        "line_start": 39,
        "path": "sources/stack-report.md"
      },
      "title": "signer allowlists are bypassable",
      "vulnerable_commit": "e9cf7c602b664da195700d8cca0ca5565e4dec4d"
    },
    {
      "block_sha256": "c5f02f8021f52652a7ba2c5e2ff32429326edb66db25c7c9de2a0637ba287255",
      "evidence": [
        {
          "commit": "e9cf7c602b664da195700d8cca0ca5565e4dec4d",
          "line_end": 3072,
          "line_start": 3056,
          "path": "crates/tirith-core/src/engine.rs"
        }
      ],
      "ledger_ordinal": 8,
      "normalized_severity": "high",
      "report_id": "stack",
      "report_ordinal": 8,
      "reported_severity": "High",
      "section": "pr_198_c04_c12",
      "source_id": "STACK-008",
      "source_locator": {
        "line_end": 41,
        "line_start": 41,
        "path": "sources/stack-report.md"
      },
      "title": "RPC path denials never match",
      "vulnerable_commit": "e9cf7c602b664da195700d8cca0ca5565e4dec4d"
    },
    {
      "block_sha256": "1e3f749105558936bd3c97dfebf29de36236359cf06e00b19b6bf79dd67f5ea7",
      "evidence": [
        {
          "commit": "e9cf7c602b664da195700d8cca0ca5565e4dec4d",
          "line_end": 636,
          "line_start": 626,
          "path": "crates/tirith-core/src/task.rs"
        }
      ],
      "ledger_ordinal": 9,
      "normalized_severity": "high",
      "report_id": "stack",
      "report_ordinal": 9,
      "reported_severity": "High",
      "section": "pr_198_c04_c12",
      "source_id": "STACK-009",
      "source_locator": {
        "line_end": 43,
        "line_start": 43,
        "path": "sources/stack-report.md"
      },
      "title": "Web3 fact counts can launder an unmodeled shell segment",
      "vulnerable_commit": "e9cf7c602b664da195700d8cca0ca5565e4dec4d"
    },
    {
      "block_sha256": "c321d68727d1f1a7752fcf285f0873316dc68cedaf3cf10e0628d1aed4719dac",
      "evidence": [
        {
          "commit": "e9cf7c602b664da195700d8cca0ca5565e4dec4d",